Name,Created,Location,Original Publish Date,Tags
Unvetted Thoughts and Inspos,"August 22, 2021 5:37 PM",,"June 30, 2023",
A Numbers Driven Approach to Transforming My Body and Health,"June 17, 2022 5:20 PM","Florida, Miami, United State of America","June 10, 2022","Fitness, Health, Personal"
Journal Entry,"August 22, 2021 5:46 PM","Miami, United State of America","August 19, 2021","Personal, Reflection"
Ez Devlin Abstract Journal Entry,"August 22, 2021 5:38 PM","Miami, United State of America","August 19, 2021","Personal, Reflection"
Using JWT Authentication on a GraphQL API with OTP Issued ID Tokens,"August 29, 2021 1:18 PM","Miami, United State of America","July 7, 2021",Tech & Code
Self Analysis on Relationships Journal Entry,"August 22, 2021 5:49 PM","Miami, United State of America","June 14, 2021","Personal, Reflection"
"What Actually Makes Demos, MVPs, and Full-Products Different?","August 29, 2021 1:16 PM","Miami, United State of America","April 19, 2021",Opinion
Journal Entry,"August 23, 2021 1:43 AM","Miami, United State of America","April 17, 2021",Personal
Goals for 2021,"August 23, 2021 2:17 AM","Miami, United State of America","November 13, 2020","Personal, Reflection"
Blame a lack of substance,"September 8, 2020 11:27 PM",,"September 8, 2020",Reflection
Greed,"August 30, 2021 1:35 PM","Miami, United State of America","May 15, 2020",Art
Adventure and Reflection,"August 30, 2021 1:34 PM","Miami, United State of America","May 15, 2020",Art
You're Upside Down,"August 30, 2021 1:33 PM","Miami, United State of America","May 15, 2020",Art
Why You Need to Set Your Own Goals,"August 29, 2021 1:56 PM","Miami, United State of America","May 15, 2020","Opinion, Reflection"
Minimalism quote,"February 17, 2020 6:04 PM",,"February 17, 2020","Minimalism, Research"
Using serverless functions to stand up REST endpoints on an 8base Workspace,"August 29, 2021 1:24 PM","Austin, United State of America","February 2, 2020",Tech & Code
Journal Entry,"August 23, 2021 2:19 AM","Miami, United State of America","February 1, 2020","Personal, Reflection"
Minimalist Wardrobe Revamp,"January 8, 2020 11:45 PM",,"January 8, 2020",Research
A Simple Productivity Hack Using Bash Scripts,"August 29, 2021 1:45 PM","Miami, United State of America","November 20, 2019",Tech & Code
How to Better Describe Your Startup,"August 29, 2021 1:52 PM","Miami, United State of America","November 18, 2019","Career, Opinion"
Meeting GraphQL at a Cocktail Mixer,"August 29, 2021 1:58 PM","Florida, Miami, United State of America","October 8, 2019","Research, Tech & Code"
"Explaining SQL and NoSQL, to Grandma","August 29, 2021 1:30 PM","Miami, United State of America","September 3, 2019","Research, Tech & Code"
One Habit That Restored My Credit 100 Points,"August 29, 2021 1:49 PM","Miami, United State of America","August 30, 2019",Life Lesson
Why I left SadaPay,"August 16, 2021 1:56 PM",,"July 21, 2019","Career, Reflection"
"Ahmed, Bali","July 5, 2019 10:21 PM",,"July 5, 2019","Memory, Travel"
Buds 60th Birthday Toast,"December 19, 2019 9:25 PM",,"September 23, 2018",Memory
"It's Saturday, September 8th","August 16, 2021 1:56 PM",,"September 8, 2018",Reflection
Form Over Substance and Forgetting the Routine,"August 29, 2021 1:14 PM","Miami, United State of America","March 16, 2018",Opinion
How Culture Shapes the Chances People Take,"August 29, 2021 1:11 PM","Miami, United State of America","February 8, 2018","Opinion, Reflection"
Her.,"August 16, 2021 1:56 PM",,"July 22, 2017",Art
"$60,000 in Ethereum Off the Table","August 29, 2021 1:09 PM","Miami, United State of America","May 26, 2017",Life Lesson
Smashing Orbs for Fulfillment's Sake,"August 29, 2021 1:06 PM","Miami, United State of America","May 17, 2017","Memory, Reflection"
Journal Entry,"May 17, 2017 9:25 AM",,"May 17, 2017",Reflection
When the Sun Sets in the South,"August 29, 2021 1:04 PM","Miami, United State of America","January 27, 2017","Memory, Reflection"
The I in AI,"August 29, 2021 1:04 PM","Miami, United State of America","January 19, 2017","Opinion, Tech & Code"
Two Meaningful Steps Forward in Virtual and Mixed Reality,"August 29, 2021 1:01 PM","Miami, United State of America","October 9, 2016","Opinion, Tech & Code"
Learning to See Things Differently with 360 Photography,"August 29, 2021 1:00 PM","New York City, United State of America","August 13, 2016",Photography
Minimalism Update - Pt. 6,"August 29, 2021 12:58 PM","New York City, United State of America","August 12, 2016","Minimalism, Reflection"
Thoughts on Self.,"August 29, 2021 12:56 PM","New York City, United State of America","August 12, 2016",Reflection
Experiencing the HTC Vive as a Space Pirate,"August 29, 2021 12:55 PM","New York City, United State of America","August 5, 2016","Memory, Tech & Code"
"A Different Kind of Hackathon, from VRVU and Samsung Accelerator","August 29, 2021 12:53 PM","New York City, United State of America","August 1, 2016",Tech & Code
Will the Next Hannah Montana Be a Hologram?,"August 29, 2021 12:51 PM","Miami, United State of America","July 25, 2016","Opinion, Research"
Seeing the World as You Want to with Augmented Reality,"August 29, 2021 12:49 PM","Miami, United State of America","July 14, 2016",Tech & Code
Journal Entry,"August 17, 2021 11:52 PM",,"June 4, 2016",Reflection
How Will We Punish Virtual Crime?,"August 29, 2021 12:48 PM","Miami, United State of America","May 20, 2016","Opinion, Tech & Code"
Is Test Driven Development an Obstacle or Asset?,"August 25, 2021 1:28 PM","New York City, United State of America","May 4, 2016",Tech & Code
"A 7-day Weather Forecast, Seen from Space","August 25, 2021 12:27 PM","New York City, United State of America","April 29, 2016",Tech & Code
Update on Listening to Music in VR,"August 25, 2021 12:25 PM","New York City, United State of America","April 24, 2016",Tech & Code
Access http://Localhost on Android from OSX,"August 25, 2021 12:23 PM","New York City, United State of America","April 13, 2016",Tech & Code
Virtual Reality Music Player,"August 25, 2021 12:19 PM","New York City, United State of America","April 10, 2016",Tech & Code
Rendering a Cube in A-Frame WebVR Framework,"August 25, 2021 12:16 PM","New York City, United State of America","April 8, 2016",Tech & Code
Deploying a Rails App To Heroku,"August 25, 2021 12:15 PM","New York City, United State of America","March 25, 2016",Tech & Code
Dissecting Joins in ActiveRecord Database Queries,"August 25, 2021 12:07 PM","New York City, United State of America","March 20, 2016",Tech & Code
Few Tradesmen are Left,"August 25, 2021 12:05 PM","New York City, United State of America","March 7, 2016",Opinion
The Art of Abstraction in Code,"August 23, 2021 5:50 PM","New York City, United State of America","February 21, 2016","Research, Tech & Code"
Conceptualizing Object-Oriented Programming,"August 23, 2021 5:48 PM","New York City, United State of America","February 7, 2016","Education, Research"
-20 and 60 Degrees North,"August 23, 2021 5:44 PM","Finland, Helsinki","January 25, 2016","Reflection, Travel"
How Do You Make It In New York City?,"August 23, 2021 5:43 PM","New York City, United State of America","December 29, 2015",Reflection
How Purpose Dictates the Coffee Supply Chain,"August 23, 2021 5:41 PM","New York City, United State of America","December 24, 2015","Coffee, Research"
Flatiron School Application,"December 19, 2019 9:26 PM",,"November 1, 2015","Career, Education"
Even if it's Bad,"August 23, 2021 5:40 PM","New York City, United State of America","September 14, 2015","Opinion, Reflection"
FiveDollarFeast - A Poor Man's Dinning Guide,"August 23, 2021 5:39 PM","New York City, United State of America","May 19, 2015","Bars & Restaurants, Career"
A Guide to Making Chemex Coffee,"August 23, 2021 5:36 PM","New York City, United State of America","May 13, 2015",Coffee
Why Are Food Trucks and Taco Stands so Trendy?,"August 23, 2021 5:12 PM","New York City, United State of America","May 11, 2015","Bars & Restaurants, Opinion"
Essential Equipment to Making Chemex Coffee at Home,"August 23, 2021 5:11 PM","New York City, United State of America","May 6, 2015","Coffee, Research"
The Elusive Nature of Excellent Coffee,"August 23, 2021 5:09 PM","New York City, United State of America","May 5, 2015","Coffee, Opinion"
What I've Learned Since My Accident,"August 23, 2021 5:07 PM","Florida, Miami","April 1, 2015",Memory
On-self,"August 23, 2021 5:05 PM","New York City, United State of America","February 10, 2015",Reflection
Social Intelligence and the Speakeasy Craze,"August 23, 2021 5:03 PM","New York City, United State of America","February 5, 2015","Bars & Restaurants, Opinion"
A Few Days in Dubai,"August 23, 2021 5:00 PM","Dubai, United Arab Emirates","November 16, 2014",Travel
My Short Trip to Japan,"August 23, 2021 4:58 PM","Japan, Kyoto, Tokyo","November 13, 2014",Travel
Why Too Much Self-reflection Can Be a Bad Thing,"August 23, 2021 4:55 PM","Panama, Volcán","October 30, 2014","Opinion, Reflection"
Panamanian Scotch and Slingshots,"August 23, 2021 4:53 PM","Panama, Volcán","October 18, 2014",Reflection
Breath Mints for Breakfast,"August 23, 2021 4:51 PM","David, Panama","October 14, 2014",Reflection
Random Entry,"August 16, 2021 1:56 PM",,"September 10, 2014",Reflection
"Love, Sex, and Candy","August 16, 2021 1:56 PM",,"August 30, 2014",Reflection
2 Powerful Tips that Will Help You Stay Motivated to Workout,"August 23, 2021 4:48 PM","Panama, Volcán","August 24, 2014",Research
Journal Entry,"August 16, 2021 1:56 PM",,"August 17, 2014",Reflection
Checking in from the Jungle,"August 23, 2021 4:45 PM","Panama, Volcán","August 10, 2014",Reflection
"Roar, Roar, ROAR","August 16, 2021 1:56 PM",,"July 18, 2014",Reflection
The 3rd Time is Not the Charm,"August 23, 2021 4:42 PM","China, Shanghai","July 7, 2014",Travel
Notes from Shanghai,"July 5, 2014 6:19 PM",,"July 6, 2014","Opinion, Travel"
A Four Seasons Dinning Experience with Five-star Friends,"August 23, 2021 4:39 PM","New York City, United State of America","July 3, 2014","Cooking & Drinks, Memory, Photography"
JasCafe Shanghai,"July 2, 2014 11:26 PM",,"July 3, 2014","Coffee, Photography, Travel"
On the Flight to Shanghai,"July 1, 2014 1:55 PM",,"July 1, 2014",Memory
For Your Viewing Pleasure from Serbia to Greece,"August 23, 2021 4:35 PM","Belgrade, Greece, Hidra, Serbia","June 21, 2014","Photography, Travel"
Inventing the Geisha Flower Cocktail at Tailor Made,"August 23, 2021 4:26 PM","Athens, Greece","June 20, 2014","Bars & Restaurants, Cooking & Drinks"
Roasting and Cupping at Taf Coffee,"August 23, 2021 4:22 PM","Athens, Greece","June 19, 2014",Coffee
Tailor made roasting,"June 16, 2014 4:01 AM",,"June 16, 2014","Coffee, Travel"
Tailor Made,"August 16, 2021 1:56 PM",,"June 15, 2014","Coffee, Photography, Travel"
How Spending Too Much Can Make You See Too Little,"August 19, 2021 11:53 PM","Italy, Rimini","June 14, 2014","Opinion, Travel"
"2014 World Barista and Brewers Championship ","August 19, 2021 11:51 PM","Italy, Rimini","June 13, 2014","Coffee, Memory"
Rimini Trip,"August 16, 2021 1:56 PM",,"June 9, 2014","Coffee, Travel"
Journal Entry,"August 16, 2021 1:56 PM",,"June 9, 2014","Opinion, Reflection, Travel"
"Like Father Like Son, Like Mother Like Daughter","August 19, 2021 11:49 PM","Lake Placid, United State of America","June 8, 2014","Photography, Travel"
Journal Entry,"June 8, 2014 2:06 PM",,"June 8, 2014",Memory
On Set with the Travel Channel's Dangerous Grounds,"August 19, 2021 11:48 PM","Panama, Volcán","June 3, 2014","Coffee, Memory"
Headed back to Miami,"June 3, 2014 9:15 AM",,"June 3, 2014",Reflection
Journal Entry,"August 16, 2021 1:56 PM",,"June 2, 2014","Coffee, Travel"
Day 3 in Panama,"August 19, 2021 11:46 PM","Panama, Volcán","June 1, 2014","Photography, Travel"
Journal Entry,"June 1, 2014 10:20 AM",,"June 1, 2014","Coffee, Travel"
Day 2 in Panama,"August 19, 2021 11:45 PM","Panama, Volcán","May 31, 2014","Coffee, Photography, Travel"
Proper Etiquette at the Tavern in the Square,"August 23, 2021 4:20 PM","Boston, United State of America","May 30, 2014",Memory
Day 1 in Panama,"August 19, 2021 11:43 PM","David, Panama","May 30, 2014","Memory, Travel"
Think Like Nike and Just Do It,"August 19, 2021 11:36 PM","Boston, United State of America","May 30, 2014",Opinion
An Idea Worth Sharing,"August 19, 2021 11:34 PM","Miami, United State of America","May 30, 2014",Reflection
Being Enslaved to the Fear of Mission Out,"August 19, 2021 2:05 PM","Boston, United State of America","May 30, 2014",Opinion
Why Self-Branding is Crucial for Generation-Y,"August 19, 2021 2:04 PM","Boston, United State of America","May 30, 2014",Opinion
Making Banana Pancackes,"May 30, 2014 10:19 AM",,"May 30, 2014","Coffee, Cooking & Drinks"
First Panama Trip,"August 16, 2021 1:56 PM",,"May 29, 2014","Coffee, Travel"
Journal Entry,"May 28, 2014 3:07 PM",,"May 28, 2014",Coffee
Journal Entry,"May 27, 2014 2:40 PM",,"May 27, 2014","Coffee, Memory"
Four Years in a Flash and No Clue What Happened,"August 19, 2021 11:41 PM","Boston, United State of America","May 20, 2014",Reflection
Commencement,"May 11, 2014 11:35 PM",,"May 11, 2014",Reflection
"Don't Fight Yourself to Obey the Rules, Fight the Rules to Obey Yourself","August 19, 2021 11:40 PM","Boston, United State of America","April 28, 2014","Opinion, Reflection"
The Fun is Not Almost Over,"August 19, 2021 11:38 PM","Boston, United State of America","April 15, 2014",Reflection
I've Dropped Out of School for the Girl I Love,"August 19, 2021 11:37 PM","Boston, United State of America","April 1, 2014",Memory
Why the Fun Has Ended But Nothing Has Changed,"August 19, 2021 2:03 PM","Boston, United State of America","February 9, 2014","Opinion, Reflection"
How to Nail a Mock Interview,"August 19, 2021 2:01 PM","Boston, United State of America","February 2, 2014","Memory, Research"
Food Labels of the Future,"August 19, 2021 2:00 PM","Boston, United State of America","January 24, 2014","Art, Research"
A Minimalist Update - Pt. 5,"August 19, 2021 11:59 AM","Boston, United State of America","January 21, 2014","Minimalism, Reflection"
Creating a Resume that Explains You,"August 19, 2021 11:57 AM","Boston, United State of America","January 19, 2014",Memory
A Minimalist Update - Pt 4.,"August 19, 2021 11:56 AM","Miami, United State of America","January 16, 2014",Minimalism
"Trying to Be Interesting, Instead of Being Interested","August 19, 2021 11:55 AM","Miami, United State of America","December 21, 2013",Reflection
How to Make Vegan Cheesecake,"August 19, 2021 11:52 AM","Miami, United State of America","December 19, 2013",Cooking & Drinks
Why Playing it Safe Will Put You on the Fast Track to Mediocrity,"August 19, 2021 11:51 AM","England, London","December 17, 2013",Opinion
Life Should Be a Fantasy,"August 19, 2021 11:50 AM","England, London","December 14, 2013",Reflection
Why the Personalization of Information Has a Dark Side,"August 19, 2021 11:46 AM","England, London","December 9, 2013","Opinion, Reflection"
How to Truly Appreciate Everything that's Given to You,"August 19, 2021 11:43 AM","Lagos, Portugal","December 6, 2013","Reflection, Travel"
"A Little Town, Built by Giants","August 19, 2021 11:39 AM","Monsanto, Portugal","December 6, 2013","Photography, Travel"
Two Useful Business Tips that Will Benefit Everyone In Achieving Success,"August 19, 2021 11:37 AM","Norway, Trondheim","December 3, 2013",Research
"Beauty is Not in the Eye of the Beholder, It's in Norway","August 19, 2021 11:34 AM","Averøy, Norway, Trondheim","December 1, 2013","Photography, Travel"
Cultural Awareness in the 21st Century,"August 19, 2021 11:13 AM","England, London","November 26, 2013",Opinion
Historic Pictures of Penguins Competing in the Olympics,"August 19, 2021 11:11 AM","England, London","November 25, 2013","Art, Photography"
Living Beyond the Heartbeat,"August 19, 2021 10:14 AM","France, Paris","November 23, 2013",Reflection
Why the World's Most Intelligent People Know Nothing,"August 19, 2021 9:44 AM","England, London","November 20, 2013","Opinion, Reflection"
"My Calm, Relaxing, Raging, and Simple Birthday Weekend","August 19, 2021 9:41 AM","Budapest, Hungary","November 17, 2013",Memory
I'm Feeling Twenty-Two,"August 19, 2021 9:40 AM","Budapest, Hungary","November 16, 2013",Memory
Why Asking for Guidance Usually Leaves You Off Worse than Before,"August 19, 2021 9:39 AM","England, London","November 15, 2013","Opinion, Reflection"
An Eerie Night at London's Natural History Museum,"August 19, 2021 9:37 AM","England, London","November 14, 2013",Photography
It Doesn't Matter How Many People You've Had Sex With,"August 18, 2021 7:49 PM","England, London","November 12, 2013",Opinion
"Stunning Portraits of the World's Disappearing Indigenous Groups ","August 18, 2021 7:46 PM","England, London","November 9, 2013","Photography, Research"
Wasting Four Years at a Company Called College,"August 18, 2021 7:44 PM","England, London","November 7, 2013","Opinion, Reflection"
"Halloween is an Opportunity, Not a Holiday","August 18, 2021 7:38 PM","England, London","November 2, 2013","Memory, Opinion"
The Reason Why You Are Not Achieving Your Life Goals,"August 18, 2021 7:36 PM","England, London","October 30, 2013",Opinion
Finding My Way to Fight the Angst,"August 18, 2021 7:34 PM","England, London","October 29, 2013",Reflection
Capturing the Moments When You Had Nothing to Say,"August 18, 2021 7:32 PM","England, London","October 25, 2013","Photography, Reflection"
How Independence Can Be Self-Destructive,"August 18, 2021 7:30 PM","England, London","October 22, 2013","Opinion, Research"
From the Streets to the Stage in Under 5-Minutes,"August 18, 2021 7:28 PM","England, London","October 20, 2013","Memory, Music"
What's Worth Seeing isn't Only on the Walls at Frieze Art Fair,"August 18, 2021 7:26 PM","England, London","October 19, 2013","Art, Memory, Photography"
Here Are Some Pictures,"August 18, 2021 7:25 PM","England, London","October 17, 2013","Photography, Reflection"
Recycling Landfill Waste into Classical Instrumen,"August 18, 2021 7:23 PM","England, London","October 13, 2013",Research
The Major Leagues of International Dress Up,"August 18, 2021 7:20 PM","Gothenburg, Sweden","October 11, 2013","Photography, Travel"
Staying with a Stranger I Met on the Internet,"August 18, 2021 7:16 PM","Gothenburg, Sweden","October 10, 2013","Photography, Travel"
Waking Up to a Monster in My Bedroom,"August 18, 2021 7:15 PM","England, London","October 7, 2013",Memory
Will I Be Proud of My Stories,"August 18, 2021 7:12 PM","Belgium, Brussels","October 2, 2013","Photography, Reflection, Travel"
Learn Languages for Free Using Your Smartphone,"August 18, 2021 7:10 PM","England, London","September 28, 2013",Research
Where the Wild Things Are,"August 18, 2021 7:08 PM","England, London","September 25, 2013","Opinion, Research, Travel"
The Proud Home of Earth's Rudest People,"August 18, 2021 7:04 PM","France, Paris","September 22, 2013","Photography, Reflection, Travel"
Touring the Wimbledon All English Lawn Tennis and Croquet Club,"August 18, 2021 7:00 PM","England, London","September 17, 2013","Memory, Photography, Travel"
Soul Searching in the Homeland,"August 18, 2021 6:55 PM","Isle of Skye, Scotland","September 15, 2013","Photography, Reflection, Travel"
On the Road Again and Alone Again,"August 18, 2021 6:53 PM","England, London","September 12, 2013",Reflection
Video Blogging from an English Country Garden,"August 18, 2021 6:49 PM","England, London","September 8, 2013","Opinion, Photography"
How to Peel a Banana,"August 18, 2021 6:48 PM","England, London","September 6, 2013",Research
Finding My Place in London,"August 18, 2021 6:43 PM","England, London","September 4, 2013","Photography, Reflection, Travel"
Why Food is the Clearest Window into Culture,"August 18, 2021 6:42 PM","England, London","September 1, 2013",Opinion
Favorite Photos from the Summer of 2013,"August 18, 2021 6:39 PM","Austria, Bosnia and Herzegovina, Croatia, Germany, Greece, Hungary, Israel, Italy, Montenegro","August 30, 2013",Photography
The End of the Road,"August 18, 2021 6:36 PM","Germany, Hamburg","August 29, 2013","Photography, Reflection, Travel"
Walking into the Berlin Wall,"August 18, 2021 6:35 PM","Berlin, Germany","August 27, 2013","Photography, Travel"
A Lawless City,"August 18, 2021 6:33 PM","Czech Republic, Prague","August 25, 2013","Photography, Reflection, Travel"
The City that Lacks Intimacy,"August 18, 2021 6:31 PM","Austria, Vienna","August 24, 2013","Photography, Reflection, Travel"
"Why Experiences Should Be Shared as Stories, Not History","August 18, 2021 3:16 PM","Budapest, Hungary","August 23, 2013","Opinion, Reflection"
The Intimacy of Travel,"August 18, 2021 3:14 PM","Budapest, Hungary","August 22, 2013","Photography, Reflection, Travel"
Bosnia's Best Kept Secret with an Unexpected Surprise,"August 18, 2021 3:12 PM","Bosnia and Herzegovina, Kravice Waterfalls, Mostar","August 21, 2013","Kayaking, Memory, Photography, Travel"
Getting Pulled Over Speeding on My Way to Rivendell,"August 18, 2021 3:10 PM","Bosnia and Herzegovina, Mostar, Sarajevo","August 20, 2013","Memory, Photography, Travel"
Speed Racing through the Cliff of Bosnia,"August 18, 2021 3:09 PM","Kotor, Montenegro","August 19, 2013","Memory, Photography, Travel"
"Trying to Drive Stick through Croatia, Bosnia, and Montenegro","August 18, 2021 3:07 PM","Croatia, Dubrovnik","August 18, 2013","Memory, Photography, Travel"
Another Party on Another Island,"August 18, 2021 3:05 PM","Croatia, Hvar, Split","August 16, 2013","Memory, Photography, Travel"
Crossing Borders without a Passport,"August 18, 2021 3:03 PM","Budapest, Hungary","August 15, 2013","Memory, Travel"
"Live Like a Millionaire on $16,000/yr","August 18, 2021 3:01 PM","Budapest, Hungary","August 13, 2013","Photography, Research, Travel"
From the Beaches to Budapest,"August 18, 2021 12:58 PM","Budapest, Hungary, Israel, Tel Aviv","August 12, 2013","Photography, Travel"
The Ruins Near the Nature Reserve,"August 18, 2021 12:54 PM","Ein Gedi, Israel, Masada","August 11, 2013","Photography, Travel"
Checking the Dead Sea Off My Bucket List,"August 18, 2021 12:53 PM","Israel, The Dead Sea","August 8, 2013","Memory, Photography, Travel"
I Cannot Stop Eating,"August 18, 2021 12:47 PM","Israel, Tel Aviv","August 7, 2013","Photography, Travel"
Seeing in the Dark,"August 18, 2021 12:46 PM","Israel, Tel Aviv","August 6, 2013","Opinion, Reflection"
"It May Be Paradise Beach, But it's Not Paradise Island","August 18, 2021 12:44 PM","Greece, Mykonos","August 5, 2013","Photography, Reflection, Travel"
"I'm Staying on Paradise Beach, Right Next to Super Paradise Beach","August 18, 2021 12:43 PM","Greece, Mykonos","August 3, 2013","Reflection, Travel"
Shopping with Shots on the World's 10th Ranked Party Island,"August 18, 2021 12:42 PM","Greece, Ios","August 2, 2013","Memory, Travel"
A Few Days in Santorini Greece,"August 18, 2021 12:39 PM","Greece, Santorini","July 31, 2013","Photography, Travel"
Missing My Alarm to Go To Fira,"August 18, 2021 12:39 PM","Athens, Greece","July 30, 2013","Memory, Photography, Travel"
My Private Apartment in Athens,"August 18, 2021 12:36 PM","Athens, Greece","July 29, 2013","Photography, Travel"
8 Hours in Rome,"August 18, 2021 12:35 PM",,"July 29, 2013","Photography, Travel"
"Sea to Summit: Featuring Ice Cream, Lava, and Ladybugs","August 18, 2021 12:33 PM",,"July 27, 2013","Photography, Travel"
"Sometimes I Sit Back and Think, ""Wow...I'm Spoiled""","August 18, 2021 12:29 PM",,"July 26, 2013","Memory, Photography, Travel"
"A Photography Session in Taormina, Sicily ","August 18, 2021 12:21 PM",,"July 26, 2013","Photography, Reflection, Travel"
NYC → Moscow → Helsinki → Berlin → Taormina in 48 Hours,"August 18, 2021 12:17 PM",,"July 23, 2013","Memory, Photography, Travel"
10 Pets You Could Never Ask Your Neighbors to Watch for the Weekend,"August 18, 2021 12:13 PM",,"July 22, 2013",Research
Beds I'd Love to Bring Girls Home To,"August 18, 2021 12:11 PM",,"July 21, 2013",Research
Why Pursuing Dreams for Image is Always Unfulfilling,"August 18, 2021 12:10 PM",,"July 20, 2013","Opinion, Reflection"
Why Experience Should Come Before Reading,"August 18, 2021 12:08 PM",,"July 19, 2013","Opinion, Reflection"
Life Shouldn't Be a Game of Connect the Dots,"August 17, 2021 10:42 PM",,"July 17, 2013","Opinion, Reflection"
Why Your Morning Workout is Kind of Like Your Girlfriend,"August 17, 2021 10:40 PM",,"July 16, 2013",Opinion
How Alcohol Consumption is Related to Intelligence,"August 17, 2021 10:39 PM",,"July 15, 2013",Research
How They Put the Fortune in the Fortune Cookie,"August 17, 2021 10:37 PM",,"July 14, 2013",Research
Electro Swing: Adding Two 0s to the Roaring 20's,"August 17, 2021 10:34 PM",,"July 14, 2013","Music, Reflection"
Shop Like a Millionaire without the Millions,"August 17, 2021 10:33 PM",,"July 12, 2013",Memory
How 3D Printing Works and What is Possible,"August 17, 2021 10:31 PM",,"July 11, 2013",Research
Why We are Too Young to Be Happy,"August 17, 2021 10:29 PM",,"July 10, 2013","Opinion, Reflection"
From Russia with Love: St. Petersburg to London on the Hospitality of Strangers,"August 17, 2021 10:27 PM",,"July 9, 2013",Travel
Digital 3D Modeling: My New Clock and Wine Holder,"August 17, 2021 10:26 PM",,"July 8, 2013",Research
Digital 3D Modeling: Day 1,"August 17, 2021 10:24 PM",,"July 7, 2013",Research
I Stumbled-Upon the Future: 3D Printing and How it Can Change the World,"August 17, 2021 10:23 PM",,"July 6, 2013",Research
Why Not Believing in Something Can Be Dangerous,"August 17, 2021 10:22 PM",,"July 5, 2013",Reflection
Why YouTube is Better than Going to College,"August 17, 2021 10:20 PM",,"July 4, 2013",Opinion
